{
  "schema_version": "contextdb.roadmap-gate-ledger/v1",
  "roadmap_revision": "RFC-0001-v0.3+ERRATA-0001",
  "status_vocabulary": [
    "not_started",
    "in_progress",
    "blocked",
    "passed",
    "failed",
    "waived"
  ],
  "rules": {
    "dependency_closure_required": true,
    "proof_required": true,
    "waiver_policy": "M19 cannot be waived. Any earlier waiver requires passed dependencies and exactly one Accepted ADR whose structured Waived milestone, Waiver expires, and Residual risk fields exactly match the ledger; expiry is checked against the validator host's trusted current UTC date. Correctness invariants, authorization-before-retrieval, acknowledged durability, deletion suppression, and unresolved critical/high security findings remain mandatory for M19.",
    "release_gate": "M19"
  },
  "milestones": [
    {
      "id": "M0",
      "title": "Repository, RFC and engineering rules",
      "status": "in_progress",
      "status_reason": "Foundational artifacts are being created; passing CI proof is not yet attached.",
      "depends_on": [],
      "objective": "Create a governed workspace in which architecture, compatibility, and benchmark evidence are versioned with the code.",
      "artifacts": [
        "Cargo workspace and pinned toolchain",
        "License and community/security documents",
        "ADR template, ADR-0001 through ADR-0005, registry, and RFC errata",
        "Feature and dependency policy",
        "Benchmark-result, version-manifest, gate-ledger, and issue-label schemas",
        "Executable M0-M19 gate ledger",
        "Target-platform CI, supply-chain checks, and fuzz smoke",
        "Versioned issue-label manifest and minimal example binary"
      ],
      "tests": [
        "Formatting, Clippy, workspace tests, audit, deny, and fuzz smoke",
        "JSON Schema validation for all schemas and examples",
        "YAML parse and duplicate-label validation",
        "ADR numbering and dependency-DAG validation"
      ],
      "benchmarks": [
        "Benchmark result format validates with a documentation-only example; no performance claim"
      ],
      "demo": "Run contextdb version, open an empty in-memory database, and run the governance validator.",
      "exit_criteria": [
        {
          "id": "M0-E01",
          "text": "Required Linux x86_64, Linux arm64, and macOS arm64 CI gates pass; Windows x86_64 is reported as best-effort without hiding its result."
        },
        {
          "id": "M0-E02",
          "text": "ADR registry has one unambiguous owner for ADR-0001 through ADR-0005 and all accepted decisions include proof obligations."
        },
        {
          "id": "M0-E03",
          "text": "All governance JSON and YAML validates, the roadmap is acyclic, and every M0-M19 gate has artifacts, tests, benchmark evidence, demo, exit criteria, and proof requirements."
        },
        {
          "id": "M0-E04",
          "text": "Release/debug profiles, deterministic seed policy, feature policy, benchmark schema, and version manifest contract are documented and machine-readable where applicable."
        },
        {
          "id": "M0-E05",
          "text": "No architecture decision required for M1 is unowned or left only as contradictory RFC prose."
        }
      ],
      "required_proof": [
        {
          "kind": "ci_report",
          "path": "proof/M0/ci.json"
        },
        {
          "kind": "test_report",
          "path": "proof/M0/governance-validation.json"
        },
        {
          "kind": "documentation",
          "path": "docs/architecture/v1-overview.md"
        },
        {
          "kind": "demo_log",
          "path": "proof/M0/demo.log"
        }
      ]
    },
    {
      "id": "M1",
      "title": "In-memory universal reference semantics",
      "status": "not_started",
      "depends_on": ["M0"],
      "objective": "Build a slow deterministic correctness oracle without disk or ANN.",
      "artifacts": [
        "Typed universal memory domain model",
        "In-memory snapshots and transactions",
        "Deterministic logical import/export",
        "Domain-pack registry and canonical fixtures"
      ],
      "tests": [
        "Temporal, perspective, policy, correction, relationship, merge/split, and serialization properties",
        "At least 10000 deterministic state-machine operations",
        "Logical multimodal selector conformance"
      ],
      "benchmarks": [
        "Reference-engine correctness baseline for BENCH-A, BENCH-B, BENCH-C, and BENCH-G fixtures"
      ],
      "demo": "Resolve the Japan-bar reference and distinguish its historical discussion from current commitment state.",
      "exit_criteria": [
        {
          "id": "M1-E01",
          "text": "All universal semantic invariants and state-machine checks pass with deterministic seeds."
        },
        {
          "id": "M1-E02",
          "text": "Core contains no code-domain-specific type and domain packs use namespaced extensions."
        },
        {
          "id": "M1-E03",
          "text": "Logical export/import is canonical, deterministic, and preserves identity, perspective, ownership, consent, and lineage."
        }
      ],
      "required_proof": [
        {
          "kind": "test_report",
          "path": "proof/M1/reference-conformance.json"
        },
        {
          "kind": "benchmark_result",
          "path": "proof/M1/reference-baseline.json"
        },
        {
          "kind": "demo_log",
          "path": "proof/M1/japan-bar.log"
        }
      ]
    },
    {
      "id": "M2",
      "title": "Storage substrate bake-off",
      "status": "not_started",
      "depends_on": ["M1"],
      "objective": "Select a provisional embedded substrate using measured ContextDB workloads rather than backend marketing claims.",
      "artifacts": [
        "StorageEngine contract",
        "Memory, Fjall, and redb implementations",
        "RocksDB comparison adapter",
        "BENCH-0001 report and substrate ADR"
      ],
      "tests": [
        "Backend conformance for snapshots, atomic batches, iteration, checkpoint, verify, and recovery",
        "Crash, lost-response, corruption, ENOSPC, and compaction-interference matrix"
      ],
      "benchmarks": [
        "BENCH-0001 storage bake-off with episode append, semantic transactions, adjacency, subject-local scans, revisions, vector delta, snapshots, compaction, and recovery"
      ],
      "demo": "Run the same durable workload against the two conforming pure-Rust candidates and emit one comparable result bundle.",
      "exit_criteria": [
        {
          "id": "M2-E01",
          "text": "A provisional default is selected by an accepted ADR with reproducible workload evidence."
        },
        {
          "id": "M2-E02",
          "text": "A second backend remains a continuously tested conformance target through M19."
        },
        {
          "id": "M2-E03",
          "text": "StorageEngine does not expose backend types or preclude ordered scans, batching, snapshots, checkpoints, and custom immutable segments."
        }
      ],
      "required_proof": [
        {
          "kind": "benchmark_result",
          "path": "docs/benchmarks/results/m2-storage-bakeoff-windows-2026-08-12.json"
        },
        {
          "kind": "conformance_report",
          "path": "proof/M2/storage-conformance.json"
        },
        {
          "kind": "documentation",
          "path": "docs/architecture/feature-policy.md"
        }
      ]
    },
    {
      "id": "M3",
      "title": "Durable semantic journal and transaction coordinator",
      "status": "not_started",
      "depends_on": ["M2"],
      "objective": "Ensure that acknowledged experience and atomic semantic revisions survive supported crashes.",
      "artifacts": [
        "Versioned envelope and semantic operation schema",
        "Commit coordinator, idempotency, snapshots, and atomic outbox",
        "Recovery, verify, basic backup/restore, and reference replay"
      ],
      "tests": [
        "Fault injection at every commit, acknowledgement, outbox, staging, and lease boundary",
        "Duplicate request, lost response, corrupted tail, and deterministic replay tests"
      ],
      "benchmarks": [
        "Commit latency, batch size, recovery time, write amplification, and fault-matrix duration baseline"
      ],
      "demo": "Capture a conversation, terminate the process at injected points, restart, and reproduce the reference logical export.",
      "exit_criteria": [
        {
          "id": "M3-E01",
          "text": "No acknowledged observation is lost within the declared fault model."
        },
        {
          "id": "M3-E02",
          "text": "No partial semantic transaction or partial projection task publication becomes visible."
        },
        {
          "id": "M3-E03",
          "text": "Recovery and replay are deterministic and equivalent to the reference engine."
        }
      ],
      "required_proof": [
        {
          "kind": "test_report",
          "path": "proof/M3/fault-matrix.json"
        },
        {
          "kind": "conformance_report",
          "path": "proof/M3/replay-equivalence.json"
        },
        {
          "kind": "demo_log",
          "path": "proof/M3/crash-recovery.log"
        }
      ]
    },
    {
      "id": "M4",
      "title": "Persistent temporal graph, subjects and policy",
      "status": "not_started",
      "depends_on": ["M3"],
      "objective": "Persist the universal semantic model with snapshot-consistent temporal graph and authorization indexes.",
      "artifacts": [
        "Stable external and dense internal IDs",
        "Temporal node, claim, edge, conflict, subject, scope, and policy indexes",
        "Mutable deltas, immutable adjacency generations, compaction, and artifact metadata store"
      ],
      "tests": [
        "Reference-vs-persistent differential suite",